title,author,year,journal,doi,abstract,rejected_by_qualitive_screening,reason_for_qualitive_screening
Computational modeling of reconstructive surgery: The effects of the natural tension on skin wrinkling,Cavicchi A.; Gambarotta L.; Massabò R.,2009,Finite Elements in Analysis and Design,10.1016/j.finel.2009.02.006,"A computational model is presented for the simulation of procedures of reconstructive surgery characterized by the excision of a cutaneous defect and the closure and suture of the wound edges. The skin is modeled as a plane membrane with zero flexural stiffness. The membrane undergoes large deformations and is characterized by a Fung type constitutive response in biaxial tension. Skin wrinkling, which is a typical outcome of the surgery in the form of extrusion of the wound edges and dog-ears, is considered through a modification of the elastic potential as originally proposed by Pipkin's Relaxed Energy Density theory [A.C. Pipkin, The relaxed energy density for isotropic elastic membranes, IMA J. Appl. Math. 36 (1986) 85-99; A.C. Pipkin, Relaxed energy density for large deformations of membranes, IMA J. Appl. Math. 52 (1994) 197-308]. The post-buckling analysis of a stretched annular membrane performed by Geminard et al. [Wrinkle formations in axi-symmetrically stretched membranes, Eur. Phys. J. E 15 (2004) 117-126] is used to validate the model under conditions similar to those of the surgery and to discuss the influence of a pre-existing tension in the membrane on the extension of the wrinkled regions. The model is applied to simulate different surgical procedures and investigate the effects of the natural state of the skin and the shape and size of the excisions. The results explain and validate current practice. © 2009 Elsevier B.V. All rights reserved.",TRUE,Focuses on skin mechanics modeling but misses key aspects like automatic aesthetic outcome prediction and clinical validation for plastic surgery results.
Craniofacial Surgery Planning Based on Virtual Patient Models; [Modellgestützte Planung von Gesichtsoperationen am virtuellen Patienten],Weiser M.; Zachow S.; Deuflhard P.,2010,IT - Information Technology,10.1524/itit.2010.0600,"In craniofacial surgery physicians are often faced with the reconstruction of massively destroyed or radically resected tissue structures caused by trauma or tumors. Also corrections of dislocated bone fragments up to the complete modeling of facial regions in cases of complex congenital malformations are common tasks of plastic and reconstructive surgeons. Such procedures have to be planned and executed thoroughly in order to achieve the best functional as well as an optimal aesthetic rehabilitation. On this account a computer assisted modeling, planning and simulation approach allows for preoperative assessment of different therapeutic strategies on basis of individual, three-dimensional patient models. Bone structures can be mobilized and relocated under consideration of anatomical and functional constraints. The resulting facial appearance can be simulated via finite-element methods on basis of a biomechanical tissue model, and visualized using high quality rendering techniques. Such an approach is not only important for preoperative mental preparation, but also for vivid patient information, documentation, quality assurance as well as for surgical education and training. © 2010 by Oldenbourg Wissenschaftsverlag, Berlin, Germany.",TRUE,Focuses on surgical planning and simulation but misses out on using automatic prediction or objective ways to assess aesthetic results in plastic and oncological surgery.
Development of bioactive and biodegradable chitosan-based injectable systems containing bioactive glass nanoparticles,Couto D.S.; Hong Z.; Mano J.F.,2009,Acta Biomaterialia,10.1016/j.actbio.2008.08.006,"There is increasing interest in the development of new tissue engineering strategies to deliver cells and bioactive agents encapsulated in a biodegradable matrix through minimally invasive procedures. The present work proposes to combine chitosan-β-glycerophosphate salt formulations with bioactive glass nanoparticles in order to conceive novel injectable thermo-responsive hydrogels for orthopaedic reconstructive and regenerative medicine applications. The initial rheological properties and the gelation points of the developed organic-inorganic in situ thermosetting systems were revealed to be adequate for intracorporal injection. In vitro bioactivity tests, using incubation protocols in simulated body fluid (SBF), allowed the observation of bone-like apatite formation in the hydrogel formulations containing bioactive nanoparticles. The density of the apatite formed increased with increasing bioactive glass content and soaking time in SBF. These results indicate that the stimuli-responsive hydrogels could potentially be used as temporary injectable scaffolds in bone tissue engineering applications. © 2008 Acta Materialia Inc.",TRUE,"Focuses on injectable biomaterials for bone repair, missing the automatic prediction or assessment of aesthetic results in plastic or cancer surgery that the review targets."
Stress wave emission and cavitation bubble dynamics by nanosecond optical breakdown in a tissue phantom,Brujan E.-A.; Vogel A.,2006,Journal of Fluid Mechanics,10.1017/S0022112006000115,"Stress wave emission and cavitation bubble dynamics after optical breakdown in water and a tissue phantom with Nd: YAG laser pulses of 6 ns duration were investigated both experimentally and numerically to obtain a better understanding of the physical mechanisms involved in plasma-mediated laser surgery. Experimental tools were high-speed photography with 50 000 frames s-1, and acoustic measurements. The tissue phantom consisted of a transparent polyacrylamide (PAA) gel, the elastic properties of which can be controlled by modifying the water content. Breakdown in water produced a purely compressive stress wave. By contrast, in stiff PAA samples and for sufficiently large pulse energies, the compression wave was followed by an intense tensile wave, similar to the behaviour previously observed in cornea. The elastic/plastic response of the medium led to a significant decrease of the maximum size of the cavitation bubble and to a shortening of its oscillation period which was found to be related to the generation of the tensile stress wave upon breakdown. For increasing elastic modulus of the PAA, both the amplitudes of the bubble oscillation and of the stress wave emitted during bubble collapse decreased until the bubble oscillation was so strongly damped that no collapse stress wave was emitted. Numerical simulations were performed using a spherical model of bubble dynamics which includes the compressibility and elastic/plastic behaviour of the medium, viscosity, density and surface tension. The calculations revealed that consideration of the elastic/plastic behaviour of the medium surrounding the bubble is essential to describe the experimentally observed bipolar shape of the stress wave emitted upon optical breakdown. Water is a poor tissue model because the shape of the emitted stress waves and the bubble dynamics differ strongly for both materials. The mechanical properties of PAA were also found to be quite different from those of tissues. Experimental and numerical results provided evidence that the dynamic mechanical properties relevant for optical breakdown in PAA and tissue differ by as much as two orders of magnitude from the static values. The discovery of a tensile stress wave after optical breakdown in tissue-like media is of great importance for the assessment of collateral damage in laser surgery because biological tissues are much more susceptible to tensile stress than to compressive stress. © 2006 Cambridge University Press.",TRUE,"Centers on laser-induced stress waves in tissue models, not on predicting or assessing surgical aesthetic results, so it doesn’t fit the review’s focus."
Computer-assisted zygoma reconstruction with vascularized iliac crest bone graft,Modabber A.; Gerressen M.; Ayoub N.; Elvers D.; Stromps J.-P.; Riediger D.; Hölzle F.; Ghassemi A.,2013,International Journal of Medical Robotics and Computer Assisted Surgery,10.1002/rcs.1557,"Background: The reconstruction of zygoma is a challenge with regard to aesthetic and reconstructive demands. Methods: Pre-operative CT data were imported into specific surgical planning software. The mirror-imaging technique was used. A surgical guide transferred the virtual surgery plan to the operation site, whereby it fitted uniquely to the iliac donor site. A postoperative CT scan was obtained for comparing the actual postoperative graft position and shape with the pre-operative virtual simulation. Results: A mean difference of 0.71 mm (SD±1.42) for the shape analysis and 3.53 mm (SD±3.14) for the graft position was determined. The calculation of the closest point distance showed a surface deviation of<2 mm for the shape analysis with 83.6% of values and for the graft position with 35.7% of values. Conclusion: Virtual surgical planning is a suitable method for zygoma reconstruction with vascularized iliac crest bone graft, with good accuracy for restoring the three-dimensional anatomy. © 2013 John Wiley & Sons, Ltd.",TRUE,"Focuses on surgical planning accuracy without assessing aesthetic outcomes or using automated evaluation, so it doesn't fit the review’s topic."
Real-time endovascular guidewire position simulation using shortest path algorithms,Schafer S.; Singh V.; Noël P.B.; Walczak A.M.; Xu J.; Hoffmann K.R.,2009,International Journal of Computer Assisted Radiology and Surgery,10.1007/s11548-009-0385-z,"Purpose: Treatment of vascular disease often involves endovascular interventions which use the vascular system for delivering treatment devices via a previously inserted guidewire to the diseased site. Previous studies show relative reproducibility of guidewire position after insertion, indicating that the guidewire position is constrained and could be represented by an energy minimization approach. Such representation would support the surgeon's decision process in guidewire selection. Methods: In this paper, we determine the guidewire position using a k-level graph based on 3D vessel information. Guidewire properties are incorporated into the graph as edge weights given by the local bending energy related to the local bending angle. The optimal path through this weighted directed graph is determined using a shortest path algorithm. Volumetric data of two different internal carotid artery phantoms (Ø 3.5-4.6 mm) was acquired. Two guidewires (Ø 0.33 mm) of different material properties (stainless steel, plastic-coated steel core) were inserted into the phantoms. Results: The average RMS distance between actual and simulated guidewire positions varies from 0.9 mm (plastic coated) to 1.3 mm (stainless steel); the computation time to determine the position was <2s. Conclusions: The results indicate that the proposed technique yields reproducible and accurate guidewire positions within a short, clinically relevant time frame. These calculated positions may be useful in facilitating neurovascular interventions. © CARS 2009.",TRUE,"Centers on guidewire simulation for vascular procedures without discussing automated prediction or assessment of cosmetic results in plastic or cancer surgeries, so it doesn’t match the review’s focus."
Reconstruction of 3D human facial images using partial differential equations,Elyan E.; Ugail H.,2007,Journal of Computers,10.4304/jcp.2.8.1-8,"One of the challenging problems in geometric modeling and computer graphics is the construction of realistic human facial geometry. Such geometry are essential for a wide range of applications, such as 3D face recognition, virtual reality applications, facial expression simulation and computer based plastic surgery application. This paper addresses a method for the construction of 3D geometry of human faces based on the use of Elliptic Partial Differential Equations (PDE). Here the geometry corresponding to a human face is treated as a set of surface patches, whereby each surface patch is represented using four boundary curves in the 3-space that formulate the appropriate boundary conditions for the chosen PDE. These boundary curves are extracted automatically using 3D data of human faces obtained using a 3D scanner. The solution of the PDE generates a continuous single surface patch describing the geometry of the original scanned data. In this study, through a number of experimental verifications we have shown the efficiency of the PDE based method for 3D facial surface reconstruction using scan data. In addition to this, we also show that our approach provides an efficient way of facial representation using a small set of parameters that could be utilized for efficient facial data storage and verification purposes. © 2006 ACADEMY PUBLISHER.",TRUE,"Focuses on 3D facial reconstruction methods but misses exploring automatic prediction or assessment of aesthetic results in plastic or cancer-related surgery, so it doesn’t quite fit the review’s focus."
A bounded iterative closest point method for minimally invasive registration of the femur,Rodriguez Y Baena F.; Hawke T.; Jakopec M.,2013,"Proceedings of the Institution of Mechanical Engineers, Part H: Journal of Engineering in Medicine",10.1177/0954411913500948,"This article describes a novel method for image-based, minimally invasive registration of the femur, for application to computer-assisted unicompartmental knee arthroplasty. The method is adapted from the well-known iterative closest point algorithm. By utilising an estimate of the hip centre on both the preoperative model and intraoperative patient anatomy, the proposed 'bounded' iterative closest point algorithm robustly produces accurate varus-valgus and anterior-posterior femoral alignment with minimal distal access requirements. Similar to the original iterative closest point implementation, the bounded iterative closest point algorithm converges monotonically to the closest minimum, and the presented case includes a common method for global minimum identification. The bounded iterative closest point method has shown to have exceptional resistance to noise during feature acquisition through simulations and in vitro plastic bone trials, where its performance is compared to a standard form of the iterative closest point algorithm. © IMechE 2013.",TRUE,"Focuses on a technical method for knee surgery without covering aesthetic outcomes in plastic or cancer-related surgery, so it doesn’t fit the review’s topic."
Foam-like scaffolds for bone tissue engineering based on a novel couple of silicate-phosphate specular glasses: Synthesis and properties,Vitale-Brovarone C.; Baino F.; Bretcanu O.; Verné E.,2009,Journal of Materials Science: Materials in Medicine,10.1007/s10856-009-3788-z,"Glass-ceramic scaffolds mimicking the structure of cancellous bone were produced via sponge replication technique by using a polyurethane foam as template and glass powder below 30 μm as inorganic phase. Specifically, a SiO2-based glass of complex composition and its corresponding P2O5-based ""specular"" glass were used as materials for scaffolding. The polymeric sponge was thermally removed and the glass powders were sintered to obtain a replica of the template structure. The scaffolds were investigated and compared from a structural, morphological and mechanical viewpoint by assessing their crystalline phases, volumetric shrinkage, pores content and interconnection, mechanical strength. In addition, the scaffolds were soaked in acellular simulated body fluid to investigate their in vitro behaviour. The produced scaffolds have a great potential for bone reconstructive surgery because their features, such as shape, strength, bioactivity and bioresorption, can be easily tailored according to the end use. © 2009 Springer Science+Business Media, LLC.",TRUE,"Focuses on biomaterial scaffolds for bone tissue engineering but doesn't cover automatic prediction or evaluation of aesthetic outcomes in plastic or oncological surgery, so it doesn't fit the review's scope."
A new system for computer-aided preoperative planning and intraoperative navigation during corrective jaw surgery,Chapuis J.; Schramm A.; Pappas I.; Hallermann W.; Schwenzer-Zimmerer K.; Langlotz F.; Caversaccio M.,2007,IEEE Transactions on Information Technology in Biomedicine,10.1109/TITB.2006.884372,"A new system for computer-aided corrective surgery of the jaws has been developed and introduced clinically. It combines three-dimensional (3-D) surgical planning with conventional dental occlusion planning. The developed software allows simulating the surgical correction on virtual 3-D models of the facial skeleton generated from computed tomography (CT) scans. Surgery planning and simulation include dynamic cephalometry, semi-automatic mirroring, interactive cutting of bone and segment repositioning. By coupling the software with a tracking system and with the help of a special registration procedure, we are able to acquire dental occlusion plans from plaster model mounts. Upon completion of the surgical plan, the setup is used to manufacture positioning splints for intraoperative guidance. The system provides further intraoperative assistance with the help of a display showing jaw positions and 3-D positioning guides updated in real time during the surgical procedure. The proposed approach offers the advantages of 3-D visualization and tracking technology without sacrificing long-proven cast-based techniques for dental occlusion evaluation. The system has been applied on one patient. Throughout this procedure, we have experienced improved assessment of pathology, increased precision, and augmented control. © 2007 IEEE.",TRUE,"Focuses on jaw surgery planning without tackling automatic aesthetic outcome prediction, and testing on just one patient limits its broader relevance here."
How to qualify and validate wear simulation devices and methods,Heintze S.D.,2006,Dental Materials,10.1016/j.dental.2006.02.002,"The clinical significance of increased wear can mainly be attributed to impaired aesthetic appearance and/or functional restrictions. Little is known about the systemic effects of swallowed or inhaled worn particles that derive from restorations. As wear measurements in vivo are complicated and time-consuming, wear simulation devices and methods had been developed without, however, systematically looking at the factors that influence important wear parameters. Wear simulation devices shall simulate processes that occur in the oral cavity during mastication, namely force, force profile, contact time, sliding movement, clearance of worn material, etc. Different devices that use different force actuator principles are available. Those with the highest citation frequency in the literature are - in descending order - the Alabama, ACTA, OHSU, Zurich and MTS wear simulators. When following the FDA guidelines on good laboratory practice (GLP) only the expensive MTS wear simulator is a qualified machine to test wear in vitro; the force exerted by the hydraulic actuator is controlled and regulated during all movements of the stylus. All the other simulators lack control and regulation of force development during dynamic loading of the flat specimens. This may be an explanation for the high coefficient of variation of the results in some wear simulators (28-40%) and the poor reproducibility of wear results if dental databases are searched for wear results of specific dental materials (difference of 22-72% for the same material). As most of the machines are not qualifiable, wear methods applying the machine may have a sound concept but cannot be validated. Only with the MTS method have wear parameters and influencing factors been documented and verified. A good compromise with regard to costs, practicability and robustness is the Willytec chewing simulator, which uses weights as force actuator and step motors for vertical and lateral movements. The Ivoclar wear method run on the Willytec machine shows a mean coefficient of variation in vertical wear of 12%. Force measurements have revealed that in the beginning of the stylus/specimen contact phase the force impulse is 3-4 times higher during dynamic loading than during static loading. When correlating material properties to the wear results of 23 composite resins subjected to the Ivoclar method, some parameters could be identified and incorporated into a wear formula to predict wear with the Ivoclar method. A round robin test evaluating the wear of ten dental materials with five wear simulation methods showed that the results were not comparable, as all methods follow different wear testing concepts. All wear methods lack the evidence of their clinical relevance because prospective studies correlating in vitro with long-term in vivo results with identical materials are not available. For direct restorative materials, amalgam seems to be a realistic reference material. For indirect, namely crown and bridge materials, low strength ceramic is appropriate. © 2006 Academy of Dental Materials.",TRUE,"Focuses on dental wear simulation devices and doesn’t cover automatic prediction or aesthetics in plastic or cancer surgery, so it’s outside the review’s scope."
An algorithm for removing sections of bone from x‐ray ct models,Suto Y.; Furuhata K.,1991,Systems and Computers in Japan,10.1002/scj.4690220310,"With the current rapid advances in computer graphics and CAD/CAM technology, considerable research is being done on the display of three‐dimensional images, and this includes the medical field. One typical medical application is simulated surgery, of which bone cutting is an essential part. Facilities for removing bone sections two‐and also three‐dimensionally are required. This paper describes the algorithms developed for three‐dimensional bone section removal and designed for high speed and ease of operation. An actual plastic surgery case to which our algorithms were applied is presented. The three‐dimensional images were constructed from multislice CT data, and the simulations were performed using a high‐speed graphics processor. Copyright © 1991 Wiley Periodicals, Inc., A Wiley Company",TRUE,"Centers on bone removal techniques for surgery simulation but misses the mark on predicting or evaluating looks, which is key to this review about aesthetic assessment in plastic and cancer surgery."
Virtual reality simulator for osteotomy and fusion involving the musculoskeletal system,Hsieh M.-S.; Tsai M.-D.; Chang W.-C.,2002,Computerized Medical Imaging and Graphics,10.1016/S0895-6111(01)00034-9,"In this study, the three-dimensional virtual reality simulation system described herein provides preoperative simulation to verify that the osteotomy and fusion procedures chosen to treat musculoskeletal defects are appropriate. The system also provides an excellent means of training surgeons in new operations without putting patients at risk, and may be especially useful for difficult surgical procedures often performed in orthopedics, craniofacial disease, or plastic and reconstructive surgery departments. The system can be used to teach intern and train resident doctors, and is a planning tool for visiting staff. © 2002 Elsevier Science Ltd. All rights reserved.",TRUE,"Focus stays on a VR training simulator without measuring or predicting aesthetic results, so it doesn’t fit the topic."
Surgical Strategies and Perioperative Outcomes of Robot-Assisted Vena Cava Reconstruction,Cheng G.; Xing Y.; Jiang G.; Liang H.; Chen Z.; Zhang X.,2024,International Journal of Medical Robotics and Computer Assisted Surgery,John Wiley and Sons Ltd,"Abstract  Objective: To summarize the surgical strategies and perioperative outcomes of robot-assisted vena cava reconstruction (RAVCR).  Methods: We retrospectively analyzed the clinical data of 11 patients who underwent RAVCR from January 2018 to December 2021. The surgical techniques, perioperative outcomes, and complications were reviewed.  Results: The mean operative time was 320 ± 45 minutes, and the mean estimated blood loss was 250 ± 80 mL. All patients underwent successful vena cava reconstruction without conversion to open surgery. The mean hospital stay was 7.5 ± 2.3 days. No perioperative mortality occurred. Two patients experienced minor complications, which were managed conservatively.  Conclusions: RAVCR is a feasible and safe technique with favorable perioperative outcomes. It offers a minimally invasive alternative for vena cava reconstruction with precise surgical manipulation and rapid recovery. Further studies with larger cohorts are warranted to validate these findings.",TRUE,"Focuses on surgical methods and short-term results without covering automatic prediction or aesthetic evaluation, which falls outside the review's scope. The small sample and no objective beauty measures also limit how useful the findings are."
